{
  "$ref": "#/definitions/testimonials",
  "definitions": {
    "testimonials": {
      "type": "object",
      "properties": {
        "name": {
          "type": "string"
        },
        "context": {
          "type": "string"
        },
        "quote": {
          "type": "string"
        },
        "image": {
          "type": "string"
        },
        "order": {
          "type": "number",
          "default": 99
        },
        "$schema": {
          "type": "string"
        }
      },
      "required": [
        "name",
        "quote"
      ],
      "additionalProperties": false
    }
  },
  "$schema": "http://json-schema.org/draft-07/schema#"
}